{
  "$schema": "https://json-schema.org/draft/2020-12/schema",
  "$id": "https://raw.githubusercontent.com/AmineChr54/umbra/main/schemas/widget.schema.json",
  "title": "Umbra widget manifest (widget.json)",
  "description": "Describes one Umbra desktop widget. The same rules are enforced by scripts/catalog.mjs in CI and by the app when it installs a widget.",
  "type": "object",
  "required": ["id", "name", "description", "author", "version"],
  "properties": {
    "$schema": { "type": "string" },
    "id": {
      "type": "string",
      "pattern": "^[a-z0-9][a-z0-9-]{1,39}$",
      "description": "Lowercase letters, digits and dashes (2-40 chars). Must equal the folder name."
    },
    "name": { "type": "string", "minLength": 1, "description": "Shown in Settings and the tray menu." },
    "description": { "type": "string", "minLength": 1, "description": "One sentence for the Browse page." },
    "author": { "type": "string", "minLength": 1, "description": "GitHub user name." },
    "version": {
      "type": "string",
      "pattern": "^\\d+\\.\\d+\\.\\d+$",
      "description": "Semantic version. Bump it on every change so users see an Update button."
    },
    "entry": { "type": "string", "default": "index.html", "description": "The page Umbra loads, relative to the widget folder." },
    "preview": { "type": "string", "description": "Screenshot shown in Browse (PNG, 2x, black background)." },
    "width": { "type": "integer", "minimum": 80, "maximum": 1200, "default": 320, "description": "Logical (96-DPI) pixels; Umbra scales for the display." },
    "height": { "type": "integer", "minimum": 80, "maximum": 1200, "default": 180, "description": "Logical (96-DPI) pixels." },
    "themeable": { "type": "boolean", "default": true, "description": "Set false to keep the widget's own look: the user's theme is not applied to it." },
    "defaultPosition": {
      "type": "object",
      "description": "Offset from the top-left of the primary work area, in logical pixels. Omit to start at the top right.",
      "required": ["x", "y"],
      "properties": { "x": { "type": "integer" }, "y": { "type": "integer" } },
      "additionalProperties": false
    },
    "permissions": {
      "type": "object",
      "properties": {
        "hosts": {
          "type": "array",
          "description": "Every HTTPS hostname the widget may contact (fetch, images, scripts, umbra.fetchJson). Everything else is blocked. Hostnames only: no scheme, port or path.",
          "items": { "type": "string", "pattern": "^(?=.{1,253}$)([a-zA-Z0-9]([a-zA-Z0-9-]{0,61}[a-zA-Z0-9])?\\.)+[a-zA-Z]{2,}$" },
          "uniqueItems": true
        },
        "commands": {
          "type": "array",
          "maxItems": 16,
          "description": "Local programs the widget may start with umbra.run(id, params?). Each is an exact executable plus an argument array (no shell). The user is asked to approve each command the first time it runs, and again whenever it changes. Browse flags widgets that declare commands.",
          "items": { "$ref": "#/$defs/command" }
        }
      },
      "additionalProperties": false
    },
    "options": {
      "type": "object",
      "description": "User settings shown in My widgets, in this order. Values reach the page as umbra.options.<key>.",
      "additionalProperties": { "$ref": "#/$defs/option" }
    }
  },
  "additionalProperties": false,
  "$defs": {
    "command": {
      "type": "object",
      "required": ["id", "run"],
      "properties": {
        "id": { "type": "string", "pattern": "^[a-z0-9][a-z0-9-]{0,39}$", "description": "What the page passes to umbra.run." },
        "run": {
          "type": "array",
          "minItems": 1,
          "maxItems": 32,
          "description": "[executable, ...arguments]. The executable is a plain program name found on PATH (\"claude\") or an absolute path (\"C:\\\\Tools\\\\app.exe\"). Each other element is a literal argument, or exactly \"${name}\" for a declared parameter (never part of a longer string).",
          "items": { "type": "string", "maxLength": 1024 }
        },
        "description": { "type": "string", "maxLength": 200, "description": "Shown to the user in the approval prompt and in My widgets (not verified by Umbra)." },
        "params": {
          "type": "object",
          "description": "Named string parameters. Each is passed as one argument, must not start with \"-\" unless it is one of the fixed choices, and every declared parameter must be supplied.",
          "propertyNames": { "pattern": "^[a-z][A-Za-z0-9]{0,31}$" },
          "additionalProperties": {
            "type": "object",
            "properties": {
              "maxLength": { "type": "integer", "minimum": 1, "maximum": 1000, "default": 200 },
              "choices": { "type": "array", "minItems": 1, "maxItems": 64, "items": { "type": "string", "minLength": 1 }, "description": "Only these exact values are accepted." }
            },
            "additionalProperties": false
          }
        },
        "timeoutSeconds": { "type": "integer", "minimum": 1, "maximum": 120, "default": 60, "description": "The process tree is killed after this long." }
      },
      "additionalProperties": false
    },
    "option": {
      "type": "object",
      "required": ["label", "type"],
      "properties": {
        "label": { "type": "string" },
        "type": { "enum": ["text", "number", "select", "toggle"] },
        "default": {},
        "hint": { "type": "string", "description": "Help text under the field." },
        "choices": {
          "type": "array",
          "items": {
            "type": "object",
            "required": ["value", "label"],
            "properties": { "value": { "type": "string" }, "label": { "type": "string" } },
            "additionalProperties": false
          }
        },
        "min": { "type": "number" },
        "max": { "type": "number" },
        "step": { "type": "number" }
      },
      "if": { "properties": { "type": { "const": "select" } } },
      "then": { "required": ["choices"] }
    }
  }
}
