{
  "$schema": "https://raw.githubusercontent.com/AmineChr54/umbra/main/schemas/widget.schema.json",
  "id": "study-timelapse",
  "name": "Study Time-Lapse",
  "description": "Start and stop a Study Time-Lapse capture session and open the renderer from your desktop, with a live estimate of photos, time studied and finish time. Needs a one-time setup (see the widget).",
  "author": "AmineChr54",
  "version": "1.0.0",
  "entry": "index.html",
  "preview": "preview.png",
  "width": 340,
  "height": 330,
  "defaultPosition": { "x": 24, "y": 24 },
  "permissions": {
    "hosts": [],
    "commands": [
      { "id": "status", "run": ["tasklist", "/FI", "IMAGENAME eq Capture.exe", "/NH", "/FO", "CSV"],
        "description": "Checks whether Study Time-Lapse Capture.exe is running", "timeoutSeconds": 15 },
      { "id": "start", "run": ["schtasks", "/Run", "/TN", "StudyTimeLapse Capture"],
        "description": "Starts the 'StudyTimeLapse Capture' scheduled task (which runs Capture.exe)", "timeoutSeconds": 20 },
      { "id": "stop", "run": ["taskkill", "/IM", "Capture.exe"],
        "description": "Asks Capture.exe to close (no force)", "timeoutSeconds": 20 },
      { "id": "render", "run": ["schtasks", "/Run", "/TN", "StudyTimeLapse Render"],
        "description": "Starts the 'StudyTimeLapse Render' scheduled task (which runs Render.exe)", "timeoutSeconds": 20 }
    ]
  },
  "options": {
    "title": { "label": "Title", "type": "text", "default": "Study Time-Lapse" },
    "studyHours": { "label": "Planned study time (hours)", "type": "number", "default": 6, "min": 0.5, "max": 16, "step": 0.5,
                    "hint": "Use the same value as in Capture. Progress and finish time are estimated from it." },
    "videoSeconds": { "label": "Video length (seconds)", "type": "number", "default": 45, "min": 5, "max": 600, "step": 5 },
    "fps": { "label": "Frame rate", "type": "number", "default": 30, "min": 5, "max": 60, "step": 1 },
    "capturePath": { "label": "Folder with Capture.exe (for setup text)", "type": "text", "default": "C:\\StudyTimeLapse\\dist\\StudyTimeLapse",
                     "hint": "Only used to write the one-time setup commands shown in the widget. Umbra never runs this path." }
  }
}
